Femenino,31,Internacional,Excelente,5,434,"""Hermosa""","""Mi visita fue un día que el templo festejaba comunión de niños y una boda a la tarde. Realmente estaba esplendorosa. De todas maneras creo que siempre luce muy bella. Frente a la plaza de la paz.""",Uruguay,Español,PC,22/6/2015
Masculino,62,Internacional,Excelente,5,258,"""Truly Beautiful""","""This is just one of many beautiful churches in Guanajuato but also I think the largest so if you only get to one, see this one.""",Estados Unidos,Inglés,PC,21/6/2015
Femenino,46,Nacional,Muy bueno,4,21,"""Basílica Nuestra Señora Guanajuato""","""Muy bonita y situada a un lado del bello teatro Juarez con el Pipila detrás. Hermosa por dentro y de hermosa arquitectura. En plena zona céntrica, cerca de restaurantes y hoteles.""",México,Español,PC,10/6/2015
Masculino,25,Internacional,Muy bueno,4,74,"""Bella iglesia""","""La iglesia es preciosa, sobre todo visto con iluminación nocturna ... pero dentro de la ciudad hay otros aún más bella.""",Brasil,Portugués,PC,13/5/2015
Femenino,64,Internacional,Regular,3,36,"""Hay que conocerla""","""Son de las cosas que uno visitando la ciudad de Guanajuato, no debe dejar de hacer. Es un tempolo muy antiguo que esta bastante bien conservado.""",Argentina,Español,PC,30/4/2015
Masculino,20,Internacional,Muy bueno,4,36,"""Religión""","""La atracción de las iglesias de Guanajuato es realmente la contemplación de la religión más allá de la arquitectura que es una parte atractiva que forman un conjunto con las pinturas sagradas.""",Brasil,Portugués,PC,24/4/2015
Femenino,32,Nacional,Muy bueno,4,58,"""Bella arquitectura""","""Igual que muchas de las iglesias de esta ciudad, la basílica tiene una linda arquitectura, se encuentra en el centro de la ciudad y es uno de los muchos templos que si te gusta disfrutar de los edificios antiguos, deberías visitar.""",México,Español,Móvil,24/4/2015
Masculino,,Internacional,Muy bueno,4,1200,"""Bonita iglesia""","""Ubicada en el centro de Guanajuato, aunque la gente la llama catedral, no tiene ese rango, es una iglesia. Por dentro es bonita, pero es más espectacular por fuera. Entrada gratis.""",España,Español,PC,20/4/2015
Masculino,35,Internacional,Excelente,5,320,"""Catedral de arquitectura colonial""","""Es la principal iglesia católica de Guanajuato. Esta bastante bien cuidada, el techo es bastante espectacular. Por fuera esta pintada de colores característicos muy llamativos. No cobran por entrar.""",Guatemala,Español,PC,20/4/2015
Masculino,40,Nacional,Muy bueno,4,323,"""Impresionante iglesia""","""Edificio sumamente bien conservador, que en su interior guarda realmente hermosas piezas de arte sacro. Es un lugar que lso catolicos y no catolicos pueden disfrutar por su imponente tamaño y lo que representa.""",México,Español,Móvil,6/4/2015
Masculino,18,Nacional,Excelente,5,25,"""Hermoso por fuera y por dentro""","""El interior el hermosísimo, y el exterior también, su color amarillo con rojo le da su encanto y en algunos puntos altos de la ciudad es lo primero que se reconoce.""",México,Español,PC,5/4/2015
Masculino,31,Internacional,Muy bueno,4,1498,"""Símbolo de Guanajuato""","""Sin embargo, es de color marrón dorado, tales como demasiado llamativo si además de la ciudad, en esta ciudad de este color es sólo una buena Anbai. Visiblemente perceptible incluso desde las colinas de Pibira, se ha convertido en un buen acento. Interior es sencillo y se comparará con la Europa de la iglesia, no hay ninguna cosa digna de mención.""",Japón,Japonés,PC,3/4/2015
Femenino,54,Internacional,Excelente,5,207,"""Beautiful basilica""","""This was my second time visiting the basilica. It's beautiful in the evening lit by chandeliers. The sculpture of the Virgin Mary sits on a silver pedestal and is one of the oldest pieces of Christian art in Mexico. Located in the midst of everything, it is easy to step in at any times of the day or night. The exterior has stunning colors, especially seen from the El Pipila monument on the hillside.""",Estados Unidos,Inglés,PC,1/4/2015
Femenino,32,Nacional,Excelente,5,186,"""Baroque and more""","""Make sure to see the Senora, patroness of the city, a gift from the Spanish king for all the silver. Amazingly she was old before getting to her rightful place,having been secreted away for centuries beforehand. Lots of people watching from cafes opposite, look out for the mime artist taking afternooon tea.""",México,Inglés,PC,15/3/2015
Masculino,68,Internacional,Muy bueno,4,721,"""El más barroco""","""Es imposible no quedar impresionado por las dimensiones y detalles de construcción de esta basílica. Iglesia Símbolo del poder en México, atrae a creyentes y turistas, además de los sitios.""",Brasil,Portugués,PC,10/3/2015
Femenino,,Internacional,Excelente,5,27,"""A haven of serenity""","""Now that you're settled in Guanajuato, take out your map and vow to walk the cobblestone path and visit the Basilica of Our Lady Of Guanajuato. The Mexican culture reveres Our Lady of Guadalupe, and this amazing church has many wonders to add to that special love. One practice that you'll see expressed is the hand-written prayers that are attached to the statues. It's a beautiful example of an ancient culture that connects to their religion in such a personal way.  If you time it just right, you'll also be able to step outside and savor the culinary delights of roasted corn, iced fruit bars, and fresh mangos. Then it's time for a siesta!""",Estados Unidos,Inglés,PC,4/3/2015
Masculino,41,Internacional,Muy bueno,4,40,"""De los más centrico""","""Muy bonita por dia y mas por la noche, por dentro es una Basílica muy bonita, esta muy céntrica y cerca de todo lo emblematico de la ciudad.""",Perú,Español,PC,2/3/2015
Masculino,54,Internacional,Muy bueno,4,188,"""Una joya""","""La basílica de Guanajuato es una joya arquitectónica, más que su exterior, por su interior. Aunque no seas religioso, te recomiendo entrar y apreciar el arte religioso en su máxima expresión.""",Chile,Español,PC,27/2/2015
Masculino,73,Internacional,Excelente,5,39,"""Visit the Basilica both day and night""","""My first visit to the Basilica gave me a first hand view of a young woman's coming of age mass. The church was light up and filled with well dressed people of all ages. I didn't go in during the service but viewed part of it through the portal entry. The Basilica is bright and stands out like nothing else in Guanajuato. Be sure not to miss it in the early evening as some of it is light up and creates a remarkable contrast to the deepening colors of the night sky.""",Estados Unidos,Inglés,PC,21/2/2015
Femenino,36,Nacional,Excelente,5,50,"""Simplemente una joya""","""os alrededores de la Basílica son muy bellos y si a esto se le agrega la belleza arquitectónica de la Basílica y los hermosos decorados interiores. Es un entorno que no le pide nada a las capitales europeas.""",México,Español,PC,20/2/2015
Masculino,38,Nacional,Excelente,5,88,"""Hermoso lugar""","""Ubicada enfrente de la plaza de la paz, se encuentra la Basílica, es hermoso verla de día y de noche al entrar se puede uno conectar con el ambiente celestial, definitivamente un lugar para visitar en compañía de la familia.""",México,Español,PC,19/2/2015
Femenino,66,Internacional,Excelente,5,88,"""All churches are not alike""","""This church is absolutely gorgeous! The ceiling, the colors, the textures! And it's a lovely walk to get there.""",Estados Unidos,Inglés,PC,19/2/2015
Femenino,19,Nacional,Regular,3,7,"""Santa efigenia""","""Visita obligada en guanajuato capital, es visitar la basílica de Guanajuato en donde se encuentra el cuerpo de santa efigenia en uno de los costados dentro de la iglesia, dice la leyenda que la santa se esta levandanto, su cuerpo esta recostado sobre unos almohadones, pero si te fijas bien, su cuerpo no los toca esta como volando, dicen que el dia que la santa se enderece totlamente ese dia es el fin del mundo. leyenda divertida, vale la pena verla.""",México,Español,PC,18/2/2015
Masculino,42,Nacional,Excelente,5,90,"""Una iglesia formidable""","""Es una iglesia muy bonita, que se encuentra en el corazón de Guanajuato, en la Plaza de La Paz, tienes que entrar, una arquitectura única y preciosa.""",México,Español,PC,18/2/2015
Masculino,30,Nacional,Muy bueno,4,19,"""Hermoso templo""","""Nos tocó conocerla de noche, celebrándose de noche con una boda. La Iglesia toda iluminada me pareció muy bella.""",México,Español,PC,15/2/2015
Masculino,24,Internacional,Excelente,5,39,"""Majestic in the middle of Guanajuato""","""All the churches in Guanajuato have their own character but this church has the most beautiful chandeliers!! A must to visit!""",Canadá,Inglés,PC,14/2/2015
Masculino,56,Nacional,Muy bueno,4,53,"""Un atractivo más del centro histórico""","""El contraste de su color en el centro histórico, simplemente hermoso. Un atractivo más del bello centro histórico de Guanajuato.""",México,Español,PC,7/2/2015
Masculino,55,Nacional,Muy bueno,4,14,"""Muy agradable""","""Es un templo muy bonito, nos toco escuchar misa de 6 p.m. oficiada por el obisco, estuvo muy concurrida, el problema es que habia una fiesta en honor al barrio, para conseguir un taxi, fue un triunfo, ya que tuvimos que recorrer varias cuadras, para salir del centro, pero de hay en adelante todo bien.""",México,Español,PC,27/1/2015
Masculino,40,Nacional,Muy bueno,4,33,"""Bella""","""Es un templo muy bello, fuera de la religiosidad, su arquitectura y su arte son muy buenos, es un lugar que permite conocer de forma clara el sincretismo de culturas que se dió en Guanajuato.""",México,Español,PC,12/1/2015
Femenino,36,Nacional,Excelente,5,20,"""Bellísima""","""La Basílica, ubicada en el centro de la ciudad está muy bien conservada. Bonita por dentro y por fuera.""",México,Español,PC,5/1/2015
Masculino,42,Internacional,Regular,3,282,"""El promedio de la iglesia""","""La Iglesia, que en otro país sería monumento tal vez interesante, en México es sólo una de las muchas iglesias promedio, no impresiona a cualquiera de arquitectura o diseño de interiores.""",Polonia,Polaco,PC,14/12/2014
Femenino,34,Internacional,Muy bueno,4,57,"""Hermoso lugar""","""La basílica se encuentra en el centro de la ciudad. Este es uno de los monumentos principales de la ciudad: la imposición en el exterior y bonito por dentro. ¡No se pierda!""",Canadá,Francés,PC,2/12/2014
Femenino,39,Internacional,Excelente,5,94,"""La basílica y sus colores: hermosa, vibrante""","""Imposible no notar esta postal de la ciudad. Situado en el centro histórico (muy cerca del Teatro Juárez), este edificio es notable no sólo por su belleza sino por sus colores vibrantes, con predominio de color amarillo. Pero vale la pena la visita> La arquitectura interna es tan exuberante como la externa.""",Portugal,Portugués,PC,1/12/2014
Femenino,51,Nacional,Excelente,5,26,"""Muy bonita""","""Es una iglesia muy bonita, por dentro y por fuera, y está muy bien cuidada, vale la pena detenerse a visitarla.""",México,Español,PC,30/11/2014
Masculino,27,Internacional,Muy bueno,4,1079,"""Iglesia amarilla visible visible""","""En una iglesia de colores amarillo, que se destaca notablemente en la visión panorámica del monumento a Pipila. En el interior hay una gran cantidad de araña decorada, lo que es un precioso interior. Parece que es también una afirmación contraria visiblemente brillante para el entorno o exterior de color amarillo debido a la noche.""",Japón,Japonés,PC,29/11/2014
Masculino,30,Internacional,Excelente,5,63,"""Basílica hermosa""","""Muy colorido basílica situada en el centro de Guanajuato, un gran lugar para tomar un queso mexicana de mayor venta en tazas de café, locales muy tradicional.""",Brasil,Portugués,PC,27/11/2014
Masculino,68,Internacional,Muy bueno,4,1108,"""Interesting and Picturesque Basilica!""","""Interesting and Picturesque Basilica! Walked around inside when on a weekend trip back in 2010. The church is well maintained and is easy on the eyes when looking at it from outside when walking around GTO.""",Canadá,Inglés,PC,19/11/2014
Femenino,45,Internacional,Muy bueno,4,151,"""Must see""","""I only had limited time in Guanajuato so I took a short tour of the downtown area. I stumbled upon this church and am very glad I did. It was beautiful inside and you could feel the history of it when you walked in right away. If you are in Guanajuato and have a chance to stop inside I recommend doing so. It was lovely.""",Estados Unidos,Inglés,PC,3/11/2014
Masculino,29,Nacional,Excelente,5,75,"""Visita obligada en Guanajuato""","""Este es el templo ""estrella"" en el centro de Guanajuato, cuya vista destaca gracias a que todo el frente quedó reservado para la Plaza de la Paz, por lo que tiene una visual exterior hermosa; por dentro disfruta de un elegante y adornado altar, así como nichos hermosos con columnas adosadas estilo jónico. Todo el decorado y tapices de las paredes destilan elegancia.""",México,Español,PC,28/10/2014
Masculino,34,Internacional,Muy bueno,4,90,"""Muy bella""","""Aunque por fuera no dice mucho, por dentro es un mundo a parte. Muy hermosa realmente! Una visita que deben hacer.""",Argentina,Español,PC,27/10/2014
Masculino,32,Nacional,Muy bueno,4,84,"""Mágica""","""Visité este lugar durante el festival cervantino, la verdad el ambiente es impresionante, todo es una gran fiesta... cientos de personas en las calles.""",México,Español,PC,25/10/2014
Femenino,21,Internacional,Excelente,5,145,"""Hermosa iglesia""","""Hermosa iglesia en vibrante amarillo y naranja bien situado en el centro de Guanajuato. Es la más evidente Iglesia Guanajuato, cualquiera de los lugares turísticos que vaya, pasa a través de él. Linda.""",Brasil,Portugués,PC,21/10/2014
Masculino,45,Internacional,Muy bueno,4,14,"""Excellent Architecture of the Church""","""It is an excellent church, just few steps ahead of Teatro Juarez, in the heart of the city. On the left side is the lane which goes to the University of GTO. You will find several shops and vendors selling souvenirs and Mexican artifacts. Do bargain with them. We had an excellent time at this church and clicked some very good photographs.""",India,Inglés,PC,7/10/2014
Masculino,41,Internacional,Muy bueno,4,533,"""Basilica in the heart of the city. You can't miss it.""","""Enjoy exploring this beautiful church. Incredible interior. Not to be missed while in amazing Guanajuato.""",Portugal,Inglés,PC,6/10/2014
Masculino,39,Nacional,Muy bueno,4,16,"""IMPACTANTE""","""Yo los declaro marido y mujer....... palabras del padre para cerrar con broche de hora la emotiva misa de boda , después se dan un beso y salen caminando por la alfombre roja que parecía infinita... Cliché de varias bodas pero en verdad esta iglesia es un regalo de antaño, sus murales , las columnas labradas como en un sueño, los querubines o angelitos posados en las esquinas siempre en sensación de paz, los hermosos candelabros que prenden en secuencia al empezar la misa, es muy impactante la sensación de ese inicio de luz. Un dato es que no hay donde estacionarse para que lo tomen en cuenta.""",México,Español,PC,3/10/2014
Masculino,27,Internacional,Excelente,5,313,"""Gorgeous""","""This is one of the larger basilica in Guanajuato as well as one of the more beautiful. It is right downtown and if you are walking around for any le get of time you can't miss it. A must see.""",Estados Unidos,Inglés,Móvil,29/9/2014
Femenino,65,Internacional,Pésimo,1,21,"""Amazing Architecture""","""The architecture is incredible the outside has a beautiful orange color and inside looks so perfect, clean and has impressive chandeliers and big organ.""",Estados Unidos,Inglés,PC,27/9/2014
Masculino,72,Nacional,Excelente,5,18,"""Lugares mágicos""","""Guanajuato una ciudad históricamente hermosa, debido a que en ese lugar nace una de las gestas mas significativo de la historia de México, como lo es el nacimiento de la Independencia de México, es un Estado que cuenta con Pueblos designados así por su historia, lugares donde el ambiente que se brinda a los paseante hace que se sientan como en su propio lugar de origen, Guanajuato cuenta con una diversidad en gastronomía, paisajes maravillosos, y lugares históricos como ningún otro estado de la República Mexicana, sus templos son bellisimos y datan de una antigüedad igual que su Historia como se demuestra con su bella y hermosisima Catedral de Guanajuato un lugar digno de ser Incluido en cualquier tour, cuando se visite la Ciudad de México. Teniendo lugares de paseo como León su Capital; Dolores Hidalgo: Silao y muchos lugares mas, cuenta con un sin numero de Artesanía para todos los gustos. También es de admira el museo de Jose Alfredo Jimenez compositor y cantante, famoso por sus canciones""",México,Español,PC,24/9/2014
Masculino,29,Nacional,Excelente,5,100,"""The best Basilica to see""","""What a beautiful place to visit. This ranks with any of the beautiful churches in Europe. Paintings on the ceiling and the detail of working the stone is incredible.""",México,Inglés,PC,21/9/2014
Femenino,53,Internacional,Excelente,5,85,"""SLICE OF HEAVEN!""","""I LOVE BASILICAS!! I was amazed that there was a BASILICA in Guanajuato and of course I could not come to the city without escaping for a few minutes to visit our lady and give my love to Christ. This place is glorious! and a must see for believers and nonbelievers alike. In the middle of downtown, this glorious church stands out as a reflections of the faith of the people. A definite MUST!!!""",Estados Unidos,Inglés,PC,13/9/2014
Masculino,34,Nacional,Muy bueno,4,156,"""Hermosa basílica en el centro de Guanajuato""","""Es obligatorio pasar por aquí en cualquier visita a Guanajuato y si es tu primera vez, vale la pena entrar a conocerla.""",México,Español,PC,7/9/2014
Masculino,28,Internacional,Regular,3,182,"""Majestuosa""","""Su radiante color amarillo llama la atención desde todo Guanajuato. Lindo interior colmado de flores y el cuerpo conservado de una Santa hacen del lugar una parada obligada en la caminata por el centro de Guanajuato.""",Argentina,Español,PC,2/9/2014
Femenino,26,Nacional,Excelente,5,63,"""¡¡Bellísima!!""","""Esta basilica es simplemente bella por fuera por dentro, de noche de día , tiene un altar en honor a Nuestra Sra de Guanajuato hermoso, candiles y lamparas de cristal cuelgan de sus techos, decoraciones y detalles minuciosos que hacen que sea la iglesia mas bella de Guanajuato.""",México,Español,PC,20/8/2014
Femenino,37,Nacional,Excelente,5,9,"""Impresionante""","""Magníficos los frescos. he insisto tienen que contratar un historiador ya que cada cosa tiene un significado. y son pequeños detalles que engrandecen tu visita.""",México,Español,PC,18/8/2014
Femenino,,Nacional,Excelente,5,3,"""Lindo lugar para casarse""","""Hermoso lugar para casarse. Mal lugar para confesarse. No se requiere llegar en auto a la iglesia, nosotros rentamos turibuses.""",México,Español,PC,13/8/2014
Masculino,30,Nacional,Pésimo,1,7,"""Nada interesante""","""Poco llamativa realmente, para mi gusto no va más allá de un simple templo común. Se mira más interesante el templo que está al lado del Teatro Juárez.""",México,Español,PC,13/8/2014
Masculino,33,Nacional,Regular,3,29,"""Sencillita y carismática""","""Es una basilica linda, no muy grande pero bien cuidada y con algunos detalles barrrocos y coloniales muy interesantes. Buen lugar para visitar si se es turista religioso.""",México,Español,PC,22/7/2014
Femenino,74,Internacional,Excelente,5,50,"""A wonderful church reflecting the riches of the miners of Guanajuato!""","""Home to one of the oldest statues of the virgin Mary in all of Mexico purchased for this church by the wealthy miners of the city!""",Estados Unidos,Inglés,PC,1/7/2014
Masculino,44,Internacional,Muy bueno,4,119,"""El más conocido de Guanajuato""","""Con sus colores brillantes, una de las iglesias más antiguas de Guanajuato se convierte en referencia para visitar la ciudad. Muy bien conservados, los fines de semana son siempre ocupado con los matrimonios y siempre ver parejas felices que dan un paseo a través del sitio para hacer fotografías.""",Francia,Francés,PC,21/6/2014
Masculino,25,Nacional,Excelente,5,92,"""Una joya que no debes dejar de conocer""","""La Basílica es un templo barroco del siglo XVII que engalana el centro histórico de Guanajuato.Se encuentra en perfecto estado de conservación. El interior es de estilo neoclásico. Cada rincón es un deleite: las fachadas, la herrería, los altares... a donde quiera que mires encontrarás una imagen de postal.""",México,Español,PC,17/6/2014
Masculino,70,Internacional,Excelente,5,54,"""Announcement board had a ring of parishes in the U.S.""","""After visiting the interior of the church for a brief prayer. I wandered out a side door. There was posted the catechetical schedule. Wasn't too different from parishes I had been a part of.""",Estados Unidos,Inglés,PC,7/6/2014
Femenino,66,Internacional,Excelente,5,15,"""Beautiful""","""The Basilica was open to the public. Infact as I sat in silence I was mesmerized by a stray dog who wandered in, I felt as if he was a regular. As I wandered around you can feel a greater presence... Whether it be spiritual or in the history of the place only the visitor can experience for his/herself. There was wood work being done in one of the rooms, I peeked in and saw some university students lending a hand. Beautiful. """,Estados Unidos,Inglés,PC,14/5/2014
Femenino,29,Nacional,Regular,3,20,"""Algo descuidada""","""Da la impresión que le hace falta mantenimiento, es una hermosa basílica que esta a un lado del Teatro Juarez y en frente del Jardín de la Unión.""",México,Español,PC,5/5/2014
Femenino,36,Nacional,Excelente,5,12,"""¡¡BELLA!!""","""En su interior guarda una virgen que se ha convertido en la patrona y reina de la ciudad.El santuario cuenta con tres accesos, un campanario de tres cuerpos y otra torre de estilo churrigueresco. Parte de la iglesia está dedicada al santo patrón de los mineros, San Nicolás Tolentino.""",México,Español,PC,28/4/2014
Masculino,28,Internacional,Muy bueno,4,35,"""Largest church in town""","""This church is the largest one in town and is at the center of the city. You'll probably pass by it several times on your visit so it's worth a walk through. Great historical feeling when you step inside.""",Estados Unidos,Inglés,PC,15/4/2014
Femenino,40,Internacional,Muy bueno,4,151,"""Hermosa iglesia""","""Esta iglesia tiene un aspecto muy hermoso debido a su color brillante. Alias ​​en México, que son muy aficionados a los colores que llenan nuestros olhos.Mas como la iglesia merece una visita por su hermosa vista y hacen bellas imágenes.""",Brasil,Portugués,PC,18/3/2014
Femenino,50,Internacional,Excelente,5,140,"""Más antigua imagen de México""","""Este impresionante basílica dedicada a la Virgen, tiene la imagen de la Virgen María, Nuestra Señora de Guanajuato, creado por el siglo 17, considerada la más antigua imagen cristiana México.Lindamente decorado con candelabros de cristal, la noche sigue siendo más exuberante cuando iluminada.Para católicos, hicieron un descubrimiento sorprendente, el cuerpo incorruptible de Santa Faustina, Poloneza de origen, se puede observar en la iglesia, que es donado por un Papa.""",Brasil,Portugués,PC,15/3/2014
Femenino,23,Internacional,Excelente,5,64,"""Can't Miss it!""","""The Basilica is a gorgeous honey yellow, and in the center of Plaza de la Paz. Makes for a beautiful back-drop and a great place to watch people.""",Estados Unidos,Inglés,PC,27/2/2014
Masculino,71,Internacional,Excelente,5,240,"""Beautiful Church""","""In a country with lots of historic churches and even lots of Basilicas this one is exceptional. The Pope gave a mass here - so people from GTO hold it in a special place. This should be part of a downtown walking tour that includes the Quixote museum, the Teatro Juarez, the San Diego Church (which is a little older and less ornate), the Basilica, the University (with its massive front steps), the Diego Rivera childhood home, and the Alhondiga. Throw in lunch near the Jardin and you have a wonderful day.""",Estados Unidos,Inglés,PC,15/2/2014
Masculino,32,Nacional,Excelente,5,19,"""Toda una joya""","""Es un punto clave de la ciudad con ella te ubicas majestuosa hermosa,los fines de semana siempre hay mariachis cantando con los turistas.""",México,Español,PC,14/2/2014
Masculino,60,Internacional,Regular,3,17,"""WTF?""","""The building is beautiful . There is an ATM/cajera automatico on the side of the church. Money changers in the church? Crazy.""",Estados Unidos,Inglés,PC,8/2/2014
Masculino,22,Internacional,Excelente,5,48,"""Lovely""","""This basilica is so beautiful. It sits centrally in the old town, easily accessible from union gardens. Well worth visiting, if only to admire the ceiling!""",Estados Unidos,Inglés,PC,30/1/2014
Femenino,46,Nacional,Excelente,5,12,"""Me encontré a mi misma…""","""Cada lugar que visito, voy a las iglesias, pues aparecen santos de los cuales no conocía la historia, me encontré con una imagen de la Virgen de la Paz, y en realidad creo que ella me encontró a mi, una experiencia que nunca olvidaré.""",México,Español,PC,27/1/2014
Masculino,50,Nacional,Excelente,5,16,"""Such an amazing place""","""A beautiful church, gorgeous paintings, very impressive. Lots of history in it, worth visiting ... Walking distance from anywhere in town.""",México,Inglés,PC,27/1/2014
