Género,Edad,Nacional ó Internacional,Calificación,Escala,Número de aportaciones,Título de la opinión,Opinión,País,Idioma,Dispositivo,Fecha
Masculino,38,Nacional,Excelente,5,50,"""Imponente""","""Es una construcción imponente desde que te vas acercando y la ves a lo lejos te sorprende su magnifica arquitectura. Tiene una gran cantidad de escalones en los cuales al llegar a lo mas alto podrás ver una parte de la ciudad.""",México,Español,PC,29/5/2018
Masculino,60,Internacional,Excelente,5,12,"""Explore the inside!""","""The steps are beautiful for views and exersize but use the opportunity to walk inside, watch the old library and the museum, art exhibitions, the old fantastic doors and architecture, the wandering students and professors, Sometimes they show movies and other activities for free that may be of interest, and if you speak some spanish people are more than willing to give you information about the attractions of this marvellous campus.""",Estados Unidos,Inglés,PC,26/5/2018
Femenino,22,Internacional,Excelente,5,89,"""Excelente""","""El lugar es fantástico y tiene una envidia arquitectónico. Para las personas que disfrutan de los edificios que miran bien hecho y tomar fotos con un fondo hermoso paisaje, es un lugar maravilloso.""",Portugal,Portugés,PC,25/5/2018
Femenino,49,Nacional,Excelente,5,4,"""Espectácular""","""Me gusto la arquitectura del edificio y las hermosas escaleras. Si subes las escaleras, apreciaras una hermosa vista de Guanajuato.""",México,Español,PC,20/5/2018
Femenino,23,Internacional,Excelente,5,3,"""Lugar imperdible de Guanajuato""","""Edificación que de día o de noche es imagen que no se olvida, subir sus escaleras te hace sentir que estás en hogwarts (si te gusta el mundo de fantasía de Harry Potter). Es una de las fachadas de universidad más bonita que he visto.""",Chile,Español,Móvil,6/5/2018
Femenino,34,Internacional,Excelente,5,106,"""Cuando un joven y vibrante""","""Antes de que los edificios bien construidos, los estudiantes utilizan para sentarse en las escaleras. Nahu y me siento bien el estado de ánimo de la ATO haebogil recomiendo visitar al menos una vez.""",Corea del Sur,Coreano,PC,5/5/2018
Masculino,30,Internacional,Excelente,5,62,"""Beautiful and in the center of the town""","""A great place to visit and hang out with the students and city on the steps of the building and have an icecream.""",Estados Unidos,Inglés,PC,1/5/2018
Femenino,29,Internacional,Excelente,5,18,"""ARQUITECTURA MARAVILLOSA""","""Fantástica arquitectura, nos encantó tanto la arquitectura externa como las instalaciones además fuimos en un cervantino fue increíble de verdad!""",Perú,Español,PC,30/4/2018
Masculino,35,Nacional,Excelente,5,32,"""Hermosa y Colonial""","""Sin duda la infraestructura de este hermoso lugar hace que al visitar la Ciudad de Guanajuato tengas que visitar uno de los edificios mas importantes y con una larga historia .""",México,Español,PC,27/4/2018
Masculino,22,Internacional,Muy bueno,4,578,"""Intereating history here....""","""We had hired a guide who actually went to university here, so the inside story was great. Opted not to cl8mb these steps, but do go into adjacent buildings where some of the history is displayed. Some evenings, they put up a big screen and show movies at the bottom of these steps... kinda fun!""",Estados Unidos,Inglés,PC,23/4/2018
Masculino,27,Nacional,Excelente,5,134,"""Muy lindo lugar""","""La máxima casa de estudios de Guanajuato, una infraestructura, impresionante y muy bella, si subes los escalones tendrás una vista hacia el centro de la ciudad que es imperdible.""",México,Español,PC,17/4/2018
Masculino,,Nacional,Regular,3,19,"""Un clásico… para conocer""","""De día o de noche es un lugar para la foto, está muy cerca de la plaza de la Paz. Venden muchas cosas para comer me gustó que si presentas tu credencial de estudiante te hacen descuento en la comida como hojaldras, empanadas etc. Por lo mismo qué circula mucho estudiante. Vayan todo en el centro.""",México,Español,Móvil,16/4/2018
Femenino,,Internacional,Muy bueno,4,4,"""Beautiful building""","""So many stairs, but worth the view once your at the top. Great workout on those stairs. Nice building to visit.""",Estados Unidos,Inglés,PC,16/4/2018
Masculino,48,Internacional,Excelente,5,54,"""Iconic university""","""Beautiful university. You must climb the stairs for a picture. You can recognize the university from all over the city.""",Estados Unidos,Inglés,Móvil,16/4/2018
Masculino,,Nacional,Excelente,5,6,"""Imponente""","""Buen ambiente...gran construcción y estilo...si bien no ofrece ningun servicio es una parada obligatoria en guanajuato la cual es una ciudad expectacular.""",México,Español,Móvil,9/4/2018
Femenino,31,Nacional,Excelente,5,49,"""¡Hermosa!""","""Hermoso edificio que permite admirar la tradicional cantera Guanajuatense, no pudimos entrar pero sin duda es una parada obligatoria para tomar una buena foto.""",México,Español,Móvil,5/4/2018
Femenino,70,Internacional,Regular,3,413,"""Universidad de Guanajuato""","""Esto no quiere decir que lo que vas a ver, el edificio es un buen universidad. También hay una tienda de moda, puede comprar una mercancía logotipo de la universidad. No se puede evitar debido a que el soporte de la universidad, me gustaría y también hay un producto de más para los turistas.""",Japón,Japonés,PC,4/4/2018
Masculino,34,Nacional,Excelente,5,8,"""Muy bien""","""Muy bonito lugar para tomarse fotos, un imperdible de esta ciudad, muchos escalones pero vale la pena.""",México,Español,Móvil,2/4/2018
Femenino,45,Nacional,Excelente,5,123,"""¡DEBES IR!""","""Los callejones que te llevan a la universidad son muy lindos y cuando llegas encuentras unas grandes escaleras que te llevan a la universidad, fascinante! nos encanto el lugar, ¡si vas a Guanajuato debes conocer este monumento arquitectónico!""",México,Español,PC,2/4/2018
Femenino,39,Nacional,Muy bueno,4,8,"""Imperdible""","""Muy bonito lugar las escaleras espectaculares. Nos encantó el lugar. Es una zona muy segura. No debes dejar de tomarte la foto.""",México,Español,Móvil,1/4/2018
Masculino,58,Nacional,Excelente,5,43,"""De las fotos obligadas para Facebook e Instagram""","""Lo visitamos por la mañana y salieron fotos muy bonitas de todo el lugar pues la construcción por si misma es de llamar la atención.""",México,Español,PC,26/3/2018
Masculino,47,Nacional,Excelente,5,159,"""¡¡IMPRESIONANTE!!""","""Es impresionante encontrar esta joya arquitectónica, con 88 escalones que engalanan la entrada de esta extraordinaria Universidad.""",México,Español,PC,21/3/2018
Femenino,65,Internacional,Excelente,5,36,"""Hermoso edificio""","""Imponente edificio con una gran fachada y escaleras empinadas. Pasos ofrece ideal para grupo o familia de fotos.""",Alemania,Alemán,Móvil,21/3/2018
Masculino,22,Nacional,Excelente,5,56,"""Lo mejor de Guanajuato""","""Es el edificio más bonito de La Ciudad. Háganse todas las fotos que quieran. De verdad vale la pena pasar un buen rato ahí. Visítenlo varias veces para evitar las conglomeraciones que suele haber. Lo más importante es estar atentos al tráfico. Aunque haya policía cuidando a los vehículos estar al pendiente nunca sobra.""",México,Español,Móvil,19/3/2018
Femenino,44,Nacional,Excelente,5,32,"""¡Increíble!""","""Llegar arriba y ver la ciudad desde ahí! es increíble, una joya arquitectónica, vale la pena conocerla.""",México,Español,PC,16/3/2018
Masculino,41,Internacional,Muy bueno,4,56,"""Wonderful building""","""This is a great building that is best seen up close, as well as up from the Mirador with El Pipila. The flight of stairs are great fun to climb. I actually took some courses there once.""",Estados Unidos,Inglés,PC,14/3/2018
Masculino,28,Nacional,Excelente,5,92,"""Joya arquitectonica""","""Un bellísimo edificio que adorna las calles coloniales de una maravillosa ciudad. En ocasiones con eventos especiales. Las escalinatas no son para cualquiera ya que son muy pesadas. No lo recomiendo mucho en días de clases ya que hay flujo estudiantil.""",México,Español,PC,12/3/2018
Femenino,21,Nacional,Excelente,5,28,"""Edificio impresionante""","""En edificio con mucha historia que se conserva en un excelente estado a pesar de tantos años. Vale la pena visitar (es sin costo)""",México,Español,Móvil,11/3/2018
Masculino,26,Internacional,Muy bueno,4,150,"""Los callejones de la magnífica""","""Caminamos desde el callejón junto a la iglesia, que de repente se encuentra este enorme edificio blanco, situado entre las magníficas callejones. En el sol brillante blanca escalera provoca el deseo de subir a la cima de descubrir, pero por desgracia, no todas las puertas todos los días, ir a visitar a probar suerte. Hay escalera de al lado del narrador para explicar la historia Campus'd hacer una cosa interesante. Escuelas tienda de ropa o joyas escolares tráfico en la Gran Escalera, si está interesado.""",Taiwán,Chino,PC,10/3/2018
Masculino,37,Internacional,Excelente,5,15,"""Bellísimo""","""Parada obligatoria, arquitectura hermosa. Magnífica para la vista. No hay manera de ir en Guanajuato y no se dan cuenta este bello edificio.""",Italia,Italiano,PC,5/3/2018
Masculino,47,Internacional,Regular,3,2570,"""Hermoso""","""Cuenta con una hermosa arquitectura, que recuerda a una iglesia o un castillo medieval, pero una casa de estudio. Una lástima que no sea posible el acceso.""",Brasil,Portugés,Móvil,1/3/2018
Masculino,38,Nacional,Excelente,5,54,"""Hermosa Casa de Estudios""","""Es una de las más bellas construcciones de la ciudad, su escalinata es hermosa y vale la pena muchas fotos en ella , aunque siempre hay gente alrededor.""",México,Español,PC,1/3/2018
Masculino,43,Internacional,Muy bueno,4,216,"""Universidad de Guanajuato que es también estudiantes japoneses""","""Este escaleras Siempre hay una gran cantidad de personas que hacen símbolo de la Universidad de Guanajuato. En los alrededores vio una figura de estudiantes japoneses. Es un buen ambiente.""",Japón,Japonés,Móvil,25/2/2018
Femenino,69,Internacional,Muy bueno,4,25,"""¡Mira hasta cerrar los monumentos históricos!""","""Fui en la mañana, pero no pude apreciarlo bien,  no había estudiantes. (De acuerdo con el conductor de Uber ...) pero es un paisaje muy hermoso para ver la imagen colorida casa de Pípila.""",Japón,Japonés,Móvil,24/2/2018
Femenino,35,Nacional,Muy bueno,4,83,"""De las mejores joyas arquitectonicas de Guanajuato""","""Visita obligada, impresionante construcción entre tantos callejones de camino al Museo de Diego Rivera.""",México,Español,PC,21/2/2018
Femenino,25,Internacional,Muy bueno,4,56,"""Precioso""","""Un edificio precioso y muy característico de la ciudad. De obligada visita. Nos gustó mucho conocerlo.""",España,Español,Móvil,19/2/2018
Femenino,58,Internacional,Excelente,5,757,"""The View""","""The University of Guanajuato is a centrally located building. We could not enter the building but climbing the long set of stairs offers a magnificent view.""",Canadá,Inglés,Móvil,17/2/2018
Femenino,32,Internacional,Muy bueno,4,7,"""Hermosa Universidad""","""Tomé las fotos solamente aspecto porque era domingo es la ubicación que Tachiyoreru en el centro de la ciudad para caminar, pero era grande hermoso edificio.""",Japón,Japonés,Móvil,15/2/2018
Masculino,33,Internacional,Excelente,5,93,"""285 years of history""","""Very nice building, you can’t miss the huge outside staircase. I recommend to also go inside and go up a couple of levels. 15 minutes and you can have a quick view of the history, classroom, cafeteria etc. In the main building is a small room with extra university information.""",Chile,Inglés,Móvil,15/2/2018
Masculino,,Internacional,Excelente,5,48,"""Un edificio muy estudiado""","""Imprescindible la foto en la escalinata. Edificio muy bien conservado con una arquitectura acorde con el uso.""",España,Español,PC,11/2/2018
Femenino,60,Internacional,Muy bueno,4,62,"""Hermosas escaleras""","""No se puede entrar en la universidad, pero sin duda el imponente edificio es impresionante, lo legal y observa los estudiantes subir y bajar las escaleras como si no cansado, muy hermoso lugar, el estudio no debe dar una buena condición física más allá del título.""",Brasil,Portugés,PC,8/2/2018
Femenino,45,Internacional,Regular,3,332,"""Walk By and Look at the Architecture""","""This is not really a place to visit but rather it is a place to look at while walking around and touring the city It is a colonial building with many steps and a place to sit and watch people walking by It is not a destination in itself but you will see it on any walking tour of the city.""",Estados Unidos,Inglés,PC,29/1/2018
Femenino,51,Internacional,Muy bueno,4,63,"""Hermoso e impresionante lugar""","""Grandeza arquitectónica del lugar y con una escalera que dan ganas de sentarse y tomar una foto de recuerdo. Gauanajuato símbolo de la cultura y los estudios míticas y seres Cervantes autor del trabajo D.Quixote.""",Brasil,Portugés,Móvil,28/1/2018
Masculino,49,Internacional,Excelente,5,3298,"""Arquitectura escénica""","""La alta escalera que conduce a la Universidad y el igualmente de alta fachada con los vasos de patrones y ventanas ovaladas son espectaculares alas teatrales del centro de Guanajuato, sin duda merece una visita. No se pierda.""",Italia,Italiano,PC,25/1/2018
Masculino,49,Internacional,Muy bueno,4,29,"""Colonial building with lots of steps""","""The architecture is nice. There's not a lot of things to do at this building. You can climb the steps or take pictures.""",Estados Unidos,Inglés,PC,24/1/2018
Masculino,68,Nacional,Excelente,5,28,"""Bellísima universidad""","""Sin duda una joya arquitectónica, subir sus escalinatas y la vista es imperdible, centrico, bello y sin duda uno de los tantos edificios que hacen de guanajuato patrimonio de la humanidad, he visitado aprox 14 veces la ciudad de guanajuato y no me canso de hacerlo.""",México,Español,PC,23/1/2018
Femenino,19,Nacional,Excelente,5,79,"""Really nice""","""Went there with some friends, though we only sat on the steps, admire the beauty and took some pictures it sure was worth the walk on the burning sun!""",México,Inglés,PC,16/1/2018
Masculino,,Nacional,Excelente,5,25,"""Emblemática""","""Ir a Guanajuato y no ir a este lugar es como no haber ido. Hermosa arquitectura, muy visitado y vale el boleto conocer este lugar.""",México,Español,PC,16/1/2018
Masculino,28,Internacional,Muy bueno,4,22,"""A beautiful building""","""It is a very beautiful building with too many stairs to climb. You would be happy with your picture there.""",Egipto,Inglés,Móvil,13/1/2018
Femenino,20,Nacional,Excelente,5,25,"""¡Excelente lugar para descansar!""","""Después de un día de caminar por Guanajuato, termina el día sentado en la parte más alta de las escaleras. Recuerda antes de subir, pasar por los cafés que se encuentran abajo, ¡así tendrás algo que tomar para pasar el rato!""",México,Español,PC,12/1/2018
Masculino,71,Internacional,Muy bueno,4,949,"""Hermoso edificio""","""Nos dirigimos a la universidad. Bonito edificio moderno con una arquitectura neoclásica que se alinea bien con el centro histórico. Fue construido sobre las ruinas de la antigua universidad jesuita. Subo 3 tramos de 27 pasos para encontrar un hermoso anfiteatro y una hermosa vista del Pípila en la colina opuesta. También se visita una pequeña exposición en la galería de arte de la universidad.""",Canadá,Francés,PC,6/1/2018
Femenino,37,Nacional,Excelente,5,23,"""Universidad Guanajuato""","""Este lugar me dejo sin palabras solo puedo decir que se convirtió en uno de lo lugares mas maravillosos que he conocido volvería muchas veces sólo para visitar esta maravilla, mi lugar favorito en Guanajuato.""",México,Español,Móvil,6/1/2018
Femenino,,Nacional,Excelente,5,148,"""Preciosa""","""Solo puedo imaginar lo que sienten los estudiantes que tiene el privilegio de estudiar ahí. Es un lugar hermoso que no se pueden perder.""",México,Español,Móvil,5/1/2018
Femenino,24,Nacional,Muy bueno,4,63,"""LUGAR EMBLEMÁTICO Y VISITA OBLIGADA""","""Sí vas al centro de Guanajuato debes visitarlo, desde el lugar que lo veas es un edificio con una construcción emblemática, no pasa desapercibido y resulta atractivo. Ve cómodo y atrévete a subir por todas sus escaleras hasta la puerta principal, dónde tendrás una de las mejores vista de la ciudad de Guanajuato.""",México,Español,Móvil,4/1/2018
Masculino,30,Internacional,Muy bueno,4,6,"""Gran arquitectura""","""Muy buen lugar para hacer fotos, para los fanaticos de Game of Thrones, no podran negar que este lugar recuerda a la septa de Baelor.""",Panamá,Español,PC,2/1/2018
Masculino,58,Nacional,Excelente,5,26,"""Bellísimo edificio""","""Es uno de los edificios más bonitos de la ciudad que resalta por su color blanco y con escaleras interminables... La sala es una belleza, antigua iglesia que ahora es utilizada como sala para conferencias y congresos.""",México,Español,PC,2/1/2018
Masculino,45,Internacional,Excelente,5,35,"""Arquitectura impresionante""","""La universidad es una de las atracciones que no deben faltar en tu visita a la ciudad de Guanajuato tiene una escalinata con una vista panorámica y una sensación difícil de describir tienes que visitarlo.""",Guatemala,Español,Móvil,28/12/2017
Masculino,29,Internacional,Excelente,5,21,"""Maravillosa""","""Primer punto a destacar es que mantienen muy limpia la zona y sus alrededores, se encuentra en perfecto estado, es hermosa y nos toco un señor nativo que se encontraba explicando la historia que es maravillosa, una verdadera obra de arte, recomendable asistir con familia ya que ds muy tranquilo y seguro, al llegar arriba la vista que se aprecia es en verdad algo hermoso que hace sentir orgulloso de ser Mexicano.""",Honduras,Español,Móvil,27/12/2017
Masculino,58,Internacional,Excelente,5,14,"""Impresionante""","""Quizás no sea parada importante pero si es necesaria si hay tiempo libre para recorrer la ciudad, y las personas que se acercan para dar información son grandiosos, se aprende mucho de ellos.""",Chile,Español,Móvil,25/12/2017
Masculino,27,Internacional,Excelente,5,59,"""Gotta climb those stairs!""","""An iconic feature of Guanajuato that should be visited. I recognized the steps leading up to the university in a scene from the film “Once Upon A Time In Mexico”. If it was good enough for Antonio Banderas, it was good enough for me!""",Canadá,Inglés,PC,23/12/2017
Masculino,40,Nacional,Excelente,5,2,"""Universidad de Guanajuato""","""Colonial muy hermosa de visita con toda la familia fue una experiencia inolvidable pasar previo en el callejón del beso y la Alhóndiga de Granaditas.""",México,Español,Móvil,23/12/2017
Masculino,42,Internacional,Excelente,5,107,"""Espectacular construcción de la ciudad""","""La universidad es una construcción incrustada en las ladera de la montaña, que hacen que sea uno de los edificios mas espectaculares de la ciudad.""",Perú,Español,PC,22/12/2017
Masculino,36,Internacional,Muy bueno,4,956,"""Love the architecture and as a visitor you are allowed to wander the hallways""","""There are 2 entrances to the building; you can walk up the outdoor stairs or you can walk in through 2 other entrances on the ground floor (same side or around the corner). The outside architecture is gorgeous; the interior is nothing fancy or special, but it is always nice to walk through a college building for the overall energy and vibe.""",Estados Unidos,Inglés,PC,16/12/2017
Masculino,30,Internacional,Excelente,5,59,"""Splendid view""","""It's worth walking up the beautiful limestone stairs from the street. Once you get to the top, ask reception about taking the tiny elevator to the ""fourth floor,"" which is just down the hallway. From the 4th floor terrace, the view is spectacular!""",Canadá,Inglés,PC,9/12/2017
Masculino,38,Nacional,Muy bueno,4,15,"""Hermosa""","""La escalinata y la explicación de los señores que están ahí es lo que vale la pena. Hay tienda de recuerdos y no está tan cara. Entre más temprano vayan, encontrarán menos gente.""",México,Español,PC,27/11/2017
Femenino,24,Nacional,Excelente,5,38,"""Espectacular""","""La vista desde mi terraza de la habitacion unica, no pude entrar a la universidad por que estaba cerrada, pero por fuera es espectacular.""",México,Español,PC,26/11/2017
Masculino,32,Nacional,Excelente,5,41,"""Impresionante""","""Un lugar muy bonito en el corazón de Guanajuato, quiero que mis hijos estudien aquí, es un edificio de suma importancia para la ciudad.""",México,Español,PC,24/11/2017
Masculino,29,Nacional,Muy bueno,4,22,"""Un edificio espectacular""","""El edificio es impresionante, las escaleras y la vista son bonitas, dentro de la universidad tuvimos acceso a un museo de historia natural, buen lugar para visitar.""",México,Español,PC,21/11/2017
Femenino,23,Nacional,Excelente,5,155,"""De lo mas emblemático""","""Una universidad muy hermosa y grande su bien ola arquitectura la podrás observar un lugar limpió y tranquilo además de visita guiada. A un lado les venderán recuerdos de la universidad muy con rica del jardín unión traten de llegar en taxi o camion gracias.""",México,Español,Móvil,21/11/2017
Femenino,29,Nacional,Excelente,5,42,"""Preciosa""","""Muy imponente lo mejor de la cuidad para mí gusto está hermosa. ¡Imperdible! Está justo en el centro de la ciudad y es un edificio precioso.""",México,Español,Móvil,18/11/2017
Masculino,70,Internacional,Excelente,5,925,"""Hermoso edificio escolar que no parece a la universidad""","""Este histórico ejemplo universidad construida, et al. En el siglo 18. Gran escalera en la pared blanca, está decorado en todas partes, era la pompa no creo que el edificio de la universidad. Esto también puede ir hacia arriba en el techo, se puede pasar por alto la ciudad desde allí. Las escaleras a tu lado también hay una tienda que vende la Universidad de mercancías.""",Japón,Japonés,PC,13/11/2017
Masculino,52,Internacional,Malo,2,223,"""Edificio muy bonito""","""Impresionante exterior del monumento. Tomar imágenes hermosas pena. Una vez dentro ... Lo que hay que decir nada porque allí como sala de conferencias así que voy a decir no más …""",Francia,Francés,Móvil,11/11/2017
Femenino,,Nacional,Excelente,5,42,"""Grandioso y bello edificio""","""Majestuoso rescinto. Por la noche lo iluminan y se ve espectacular. Vale la pena tomarte una fotografía aqui y subir las escaleras para que tengas un buen panorama.""",México,Español,PC,9/11/2017
Femenino,62,Internacional,Muy bueno,4,71,"""Preciosa Universidad""","""Vale la pena conocer esta hermosa Universidad. Su ingreso es gratuito. Es una Universidad de muy alto nivel. Foto obligada en sus escaleras exteriores.""",El Salvador,Español,Móvil,6/11/2017
Femenino,29,Internacional,Excelente,5,59,"""Tan importante que aparece en el billete de mil pesos""","""La Universidad de Guanajuato es tan tradicional e importante que aparece en miles de pesos nota. La historia es muy interesante. Las primeras sillas en la mano en la escuela estaban a cargo de los sacerdotes jesuitas que contó con el apoyo financiero de los mineros de la ciudad, en el siglo XVIII.""",Brasil,Portugés,PC,29/10/2017
Masculino,,Internacional,Excelente,5,15,"""Bonito lugar""","""Es raro que en una visita a alguna ciudad quieras ir a la universidad del pueblo, pero esta vale la pena visitarla.""",Argentina,Español,Móvil,26/10/2017
Masculino,48,Nacional,Excelente,5,18,"""Beautiful architecture!""","""Who goes to Guanajuato city and does not visit the University?? It is a beautiful building, and a picture in its iconic steps is a must!""",México,Inglés,PC,26/10/2017
Femenino,63,Internacional,Excelente,5,437,"""Beautiful blending of new and old""","""The steps and original building were built in the 1700s. In 1950, the addition to the right of the steps was added. Classes are no longer held here; it is an administration building. A large white screen hangs at the base of the steps, and each evening one or more movies are shown. Bring your own cushion to sit on!""",Estados Unidos,Inglés,PC,24/10/2017
Femenino,59,Internacional,Excelente,5,175,"""Cool building""","""This is very nice architectonical piece of art, so it is worth seeing in the downtown. Try to get a glance also inside the building and you will be surprised.""",Finlandia,Inglés,Móvil,22/10/2017
Masculino,21,Nacional,Excelente,5,449,"""Un edificio espectacular""","""El edificio de la Universidad de Guanajuato es muy bonito! Vale la pena visitar el edificio y si se puede entrar y visitar el interior.""",México,Español,Móvil,12/10/2017
Femenino,56,Nacional,Excelente,5,61,"""Emblema de Guanajuato""","""Es de las principales universidades en el país, rica en cultura y en belleza. Además, organizadora de gran parte de las actividades que encabezan el festival cervantino. Es un oasis y es privilegiado quien la conoce a fondo y sabe su historia. Es un lugar mágico entre la magia que rodea a Guanajuato, lleno de leyendas e historia.""",México,Español,PC,12/10/2017
Femenino,42,Internacional,Muy bueno,4,185,"""A very famous and iconic University""","""The architecture and the history of this University is what worth the most. You can not miss it, walk in thier alley, it is beautiful.""",Estados Unidos,Inglés,PC,4/10/2017
