Masculino,68,Internacional,Excelente,5,88,"""Loved those ""Spanish"" steps""","""My hotel, El Meson de los Poetas, was just a short distance away from the university and so I passed by several times in my three day stay. This is the ""old"" part of the University, but what stunning architecture. Many times the steps were half full of young people sitting, talking, studying and I´m sure enjoying the magnicifent view. I climbed the steps just to see the city and valley below, do this if you have a stong heart and a good constitution. The church next door is incredible.""",Canadá,Inglés,PC,25/11/2014
Femenino,27,Nacional,Excelente,5,17,"""Ver para creer""","""La Universidad de Guanajuato tiene una arquitectura inigualable! En perfectas condiciones y sobre todo se respira armonía y juventud!! Perfecto para una tarde por Guanajuato.""",México,Español,Móvil,19/11/2014
Masculino,39,Internacional,Excelente,5,1108,"""The Steps and the architecture are wonderful!""","""The Steps and the architecture are wonderful! On one of my recent trips to GJO I had the pleasure of walking up the impressive stairs that lead up to the University. It makes you almost imagine that you are walking in Imperial Rome or something ... really nice building.""",Estados Unidos,Inglés,PC,19/11/2014
Masculino,45,Nacional,Excelente,5,110,"""Wonderful building""","""The view of the stairs are incredible and the building is jewel of architecture, a must if you go to Guanajuato.""",México,Español,PC,9/11/2014
Masculino,75,Internacional,Excelente,5,463,"""Daughter visit""","""What a great Mexican campus Be certain you have good walking shoes This town is full of great surprises and is a tourist delight Hire local student and enjoy tunnels.""",Canadá,Inglés,Móvil,9/11/2014
Femenino,70,Internacional,Regular,3,282,"""Nice walk around""","""Very nice location in historic Guanajuato, very nice students running about and beautiful buildings. We were there for Day of the Dead and all the kids had dressed up and were parading their skeletons around. Great Fun!""",Estados Unidos,Inglés,PC,4/11/2014
Femenino,34,Nacional,Muy bueno,4,43,"""ME ENCANTA""","""Está en el mero centro de la ciudad, la encontraràs muy fàcilmente, hazte el ànimo de subir todos los peldaños de la gran escalera, puedes sacar muy lindas fotos, a mi me gusta mucho ir, con frìo o calor, es maravilloso.""",México,Español,PC,4/11/2014
Masculino,32,Nacional,Muy bueno,4,12,"""Gran inmueble que debe visitarse""","""Es un lugar que se debe visitar para poder apreciar lo que ha aportado éste inmueble a todas las personas que han pisado sus instalaciones. Normalmente está en remodelación y regularmente presentan diferentes proyectos culturales en sus salas…""",México,Español,PC,3/11/2014
Masculino,37,Internacional,Excelente,5,7,"""Great Architecture""","""I visit the University of Guanajuato and I found the real Mexico. This University is at the center of the City (like any University should be). I was looking for the faculty of Languages and it´s behind this building. The teachers are incredibly and I learned Spanish with a very high quality just in a Month and at a very reasonable price.They have also 6 Months courses but I took the intensive language course. The only bad thing is the public system transportation. The City is not fitted for buses or cars, they could use bicycles or walk, but the lazy people use cars and the City look overcrowd, they don´t care for the pedestrians so you should watch before walking.""",Suiza,Inglés,PC,3/11/2014
Femenino,42,Nacional,Excelente,5,7,"""Visible""","""Tiene una arquitectura que sobresale entre los alrededores. Fácil de ubicarla desde el cerro del Pipila.""",México,Español,PC,30/10/2014
Femenino,,Nacional,Muy bueno,4,7,"""Belleza de lugar""","""Hermoso sitio para tomar fotos, subir por sus escalinatas y admirar su hermosa estructura, me impactó.""",México,Español,PC,29/10/2014
Femenino,28,Nacional,Excelente,5,9,"""Hermoso""","""Me encanto la idea de que hicieran un cine por estos días festivos, seria interesante que dejaran entrar a conocer por dentro la universidad.""",México,Español,PC,28/10/2014
Masculino,55,Internacional,Excelente,5,69,"""Nice!""","""One of the most prominent structure in Guanajuato town area. a good place to unwind on its steps on a not so sunny day after going around the many callejons of Guanajuato town. we had a filling and delicious mexican lunch at the restaurant just infront, the Tapatio.""",Filipinas,Inglés,PC,27/10/2014
Masculino,31,Nacional,Excelente,5,84,"""Imponente""","""La arquitectura de la universidad es excelente, si subes las escaleras hasta la entrada se puede apreciar una muy buena vista de la ciudad y vaya que vale la pena, es una visita obligada cuando se va a Guanajuato.""",México,Español,PC,25/10/2014
Femenino,31,Internacional,Muy bueno,4,145,"""Hermosa arquitectura""","""La arquitectura del edificio principal es asombroso. Impresionante, y se ocultan entre las estrechas calles de Guanajuato. La universidad es la que da todo el encanto de Guanajuato, con los estudiantes caminar por todas partes.""",Brasil,Portugés,PC,21/10/2014
Femenino,47,Nacional,Muy bueno,4,16,"""Beautiful""","""Protesters are not allowed at the university, but we got to see a few on the steps dof the university. The architecture is beautiful, you wont miss it as you walk through town.""",México,Inglés,PC,11/10/2014
Masculino,23,Nacional,Excelente,5,17,"""Hermosa""","""Sin duda la arquitectura de esta universidad es única. Vale la pena entrar y percibir el olor a historia y a madera.""",México,Español,PC,9/10/2014
Masculino,45,Internacional,Muy bueno,4,14,"""Super University with excellent Architecture at City Center""","""We reached after 4 pm on the first day and hence, it was closed. Main building closes for tourists at 4pm. So, keep this in mind. It is a huge, green cantera stone picturesque building with impressive Moorish architecture. The world-famous Cervantino Festival of Guanajuato, one of the finest festivals of performing arts, was started by this university. Students of this university – artists and actors – perform in the city at various plazas on a regular basis. Various musical performances and cultural events happen here in the auditoriums inside the University building and also on the famous staircase (113 stone steps in total) at the entrance of building.""",India,Inglés,PC,7/10/2014
Femenino,35,Nacional,Excelente,5,3,"""Arquitectura""","""¡Simplemente divino! Las escalinatas de la universidad son algo que amas no voy a olvidar Guanajuato, es una ciudad maravillosa.""",México,Español,PC,1/10/2014
Masculino,36,Internacional,Excelente,5,62,"""Imponente centro académico""","""Su singular arquitectura es un componente importante de lo que constituye la esencia cultural de esta bella ciudad. Tuvimos la dicha de ir en el atardecer con mi esposa y los matices del cielo visto desde sus escalinatas son interesantes.""",Panamá,Español,PC,29/9/2014
Masculino,39,Nacional,Muy bueno,4,2,"""Excelente edificio""","""La ciudad es increíble, su arquitectura, las opciones para los turistas son excelentes, el ambiente de las callejoneadas es increíble, muy buena opción para viajar con la familia.""",México,Español,PC,27/9/2014
Masculino,53,Internacional,Excelente,5,85,"""Ladder to heaven...so it seemed!""","""The famous steps of the university are so glorious that with every step it feels as though you are getting closer to heaven! I would definitely recommend going there! it is a close walk from the Hidalgo theater and a close walk from the basilica and a close walk from the kiss alley. In other words, it is close to all that you MUST do and see while in Guanajuato!""",Estados Unidos,Inglés,PC,13/9/2014
Femenino,23,Internacional,Muy bueno,4,240,"""A escalar""","""Una construcción imponente y hermosa . El gran desafío es subir su gran escalera de entrada ! Otro imperdible de Guanajuato.""",Honduras,Español,PC,10/9/2014
Masculino,54,Nacional,Muy bueno,4,156,"""Imperdible""","""No puedes perderte visitar la universidad de Guanajuato y subir por sus escalinatas. El edificio es ,uy bonito y en tiempo escolar esta lleno de estudiantes y buen ambiente.""",México,Español,PC,7/9/2014
Masculino,66,Internacional,Muy bueno,4,232,"""Monumento nacional, impresionante escalinata""","""Sin duda, es uno de los atractivos arquitectónicos monumentales de Guanajuato.La escalinata central, por la que se accede a lo más alto del rectorado de la universidad, es la joyita del edificio. Sin dudas, es el símbolo de Guanajuato. Además, a un costado de la escalera, hay un pequeño museo de las clásicas y tradicionales estudiantinas de esta ciudad universitaria.""",Argentina,Español,PC,7/9/2014
Masculino,46,Internacional,Muy bueno,4,84,"""Majestuosa""","""Las “callejonadas” ponen el broche de oro al entretenimiento de esta ciudad y justamente, siguiendo una tradición medieval, este acontecimiento pintoresco a cargo de los estudiantes que reafirma la condición de Guanajuato como ciudad universitaria. Pero es el Majestuoso edificio de su Universidad una verdadera “catedral” para admirar su arquitectura.""",Argentina,Español,PC,6/9/2014
Masculino,27,Internacional,Muy bueno,4,182,"""Impresionante""","""Desde cualquier lugar de Guanajuato que te encuentres verás su torre o partes de su impresionante arquitectura. Se dice de Guanajuato que es una ciudad universitaria, y ese edificio no hace más que reafirmarlo. Una de las Universidades más majestuosas que he visto.""",Argentina,Español,PC,2/9/2014
Femenino,,Internacional,Muy bueno,4,1,"""Hermoso, increíble arquitectura""","""Clásico es pararte en medio de la escalinata y tomarte la foto de recuerdo. Es la universidad más bella de México, situada en un Estado que fue pieza clave en la Historia de México, estar ahí te transporta al pasado, pues es una ciudad que conserva su encanto antigüo.""",Chile,Español,PC,1/9/2014
Masculino,34,Nacional,Excelente,5,29,"""Imponente""","""La máxima casa de estudios de la ciudad tiene una escalinata imponente, rodeada de callejones sobresale en la ciudad desde cualquier punto en el que te encuentres. Es un lugar imperdible para tomarte fotos.""",México,Español,PC,1/9/2014
Femenino,33,Nacional,Excelente,5,62,"""¡Hermosa!""","""¡De los mejores atractivos que tiene la ciudad! ¡Muy recomendable! Y lo mejor que esta en el Centro y hay mas lugares por visitar muy cerca.""",México,Español,PC,25/8/2014
Femenino,26,Nacional,Excelente,5,63,"""Excelente arquitectura""","""Esta Universidad esta construida con un sinumero de detalles, excellente vista de dia o de noche , es enorme y tiene muchisimas carreras para estudiar , debajo de ella pasa un tunel, es una de las universidades mas bonitas que hay en Mexico.""",México,Español,PC,20/8/2014
Femenino,41,Nacional,Excelente,5,9,"""Impresionante y condición física para subir""","""Muy bonita pero alto y muchos escalones hay termino una callejoneada y fue muy bonito verla de noche.""",México,Español,PC,18/8/2014
Femenino,,Nacional,Excelente,5,2,"""Hermoso edificio""","""Sin duda la arquitectura de guanajuato siempre me ha dejado boquiabierta que hermoso edificio! las escalinatas del teatro estan perfectas para tomarte una foto y apreciar el edificio de mejor manera.""",México,Español,PC,16/8/2014
Masculino,26,Nacional,Excelente,5,7,"""Maravillado""","""Realmente quedé fascinado con el edificio de la Universidad, está bastante grande y desde la cima en la puerta se puede mirar la ciudad completa. Brinda una vista hermosa de noche.""",México,Español,PC,13/8/2014
Masculino,20,Nacional,Muy bueno,4,14,"""Sorprendente""","""Increible e imponente construccion que no se puede dejar pasar por alto su visita. Muy bonita y antiguo edificio.""",México,Español,PC,7/8/2014
Femenino,51,Nacional,Excelente,5,33,"""ME RECUERDA A LA PELICULA ACOMPAÑAME…""","""Me parece que si vas a Guanajuato capital y no ves este gran monumento arquitectonico es como si no comieras pejelagarto en Tabasco, es visita obligada, cuando llegue a las escalinatas pense ""uff si estudiara aqui y llegara tarde"" asi que me sente y me imagine a enrique guzman al lado cantando como su famosa pelicula con rocio durcal, ahhhh ermoso lugar...""",México,Español,PC,5/8/2014
Masculino,53,Nacional,Excelente,5,5,"""ÚNICA EN SU FACHADA""","""Su historia es excepcional, ha sido el centro de novelas e historias en los tres siglos que ha vivido; su escaalinata es única y maravillosa.""",México,Español,PC,5/8/2014
Femenino,20,Nacional,Excelente,5,5,"""Hermosa vista""","""Tuve la oportunidad de conocerla por dentro y me gustó, recordé muchas cosas de la pelicula ""el estudiante"" filmada ahí.""",México,Español,PC,5/8/2014
Masculino,67,Internacional,Excelente,5,220,"""Patrimonio de la humanidad es la ciudad entera""","""La ciudad es el centro de esta ciudad del patrimonio mundial. Es posible que desee caminar alrededor de varias maneras aquí en el principal. lindos cafés y restaurantes cercanos, y tienda de recuerdos.""",Camboya,Chino,PC,1/8/2014
Femenino,23,Nacional,Muy bueno,4,124,"""Precioso edificio""","""Y clásico para encontrarse con amigos, para ver una película en el Cervantino y para tomar mil y un fotos.""",México,Español,PC,31/7/2014
Femenino,43,Nacional,Muy bueno,4,201,"""Bellísima""","""Muy bonita a simple vista aunque no conocimos su interior su construcción data del siglo XVIII lo que hace de ella un digno emblema de la ciudad. Bellísima como muchos de los edificios de Guanajuato.""",México,Español,PC,30/7/2014
Femenino,32,Nacional,Excelente,5,39,"""Imponente dentro de una ciudad colonial""","""Sale del estilo colonial de la ciudad. Muy bonita por fuera y si logras subir los escalones por dentro también tiene un auditorio muy bello. Los guías te engañan. En la escalera al ofrecerse para tomarte una foto con tu grupo para sorprenderte al final con la historia de la universidad, pero vale la pena, la colaboración es a voluntad.""",México,Español,Móvil,25/7/2014
Masculino,67,Internacional,Excelente,5,39,"""El viejo edificio de la universidad""","""El antiguo edificio digno de su atención. Larga escalera sobre la que descansan los estudiantes y los estudiantes fotografiados. Vale la pena venir al patio de la Universidad y el edificio académico - muy agradable.""",Rusia,Ruso,PC,24/7/2014
Masculino,30,Nacional,Regular,3,29,"""Bonita e imponente""","""El edificio es imponente por las dimenciones comparado con el resto de las construcciones en la ciudad, quizas es por eso que su construcción no fue tan bien recibida por los locales. Un punto negativo es el montón de ""guías"" turisticos que empiezan a contar la historia de la Universidad, cuantos escalones tiene, y todas esas cosas que nadie realmente escuha pero que te quieren cobrar para que te las digan. Ya sabemos que tienen que trabajar, pero es bastante incomodo.""",México,Español,PC,22/7/2014
Femenino,28,Nacional,Excelente,5,12,"""Panorámica Increíble""","""Realmente recuerdas tu vida de estudiante si lo eres o si eres un pasante, nosotros nos fuimos por el callejón del Estudiante y ver esa Universidad tan bella y su estructura tan impresionante te hace recordar tu vida de estudiante, como siempre muchos turistas nacionales e internacionales tomando muchísimas fotos, enfrente hay unas pizzas y después del callejón esta la Iglesia.""",México,Español,PC,22/7/2014
Femenino,35,Nacional,Excelente,5,72,"""LA MAS HERMOSA UNIVERSIDAD DEL MUNDO""","""Y aparte es Patrimonio de la Humanidad, Majestuosa, impresionante, cualquiera que la vea, se enamora de su belleza, y acompañada de sus escalones, que hay que subirlos,para admirar la vista que nos ofrece del Hermoso Guanajuato, y también entrar a sus recintos y aulas,huele a madera,y a cantera tierra mojada. su color, claro que al bajar,tienes que hacerlo con cuidado, ya que son escalones pequeños,descansa y baja con cuidado, claro que te permiten entrar a todoas las áreas ,si hay eventos ó catedras,entra escucharas a catedráticos y personalidades con grandes coeficientes y estudios,y hay edificios anexos a otra especialidades con acceso libre, esta en una cuadra pequeña,que solo cabe un auto, y no siempre esta abierta así que si traes auto pasa por ahí que tal vez No lo vuelvas a ver pero lo mejor es caminar,esta seguro.""",México,Español,PC,22/7/2014
Femenino,26,Nacional,Excelente,5,10,"""Más que una gran escalera""","""Este lugar es conocido por su incríble escalinata, pero además de un buen lugar para las fotos, la Universidad de Guanajuato da excelentes opciones para hacer algo más durante tu estancia en la ciudad, ofrece una gran cantidad de eventos durante todo el año. A nosotros nos tocó asistir a un tinguis ecológico donde pudimos escuchar al trío de huapango ""El Guanaxteco"", grandes músicos.""",México,Español,PC,9/7/2014
Femenino,28,Internacional,Muy bueno,4,60,"""¡Lindo!""","""Estéticamente bella. Antigua y muy bien mantenida. Las escaleras llevan a una hermosa vista de la ciudad.""",Argentina,Español,PC,8/7/2014
Femenino,29,Nacional,Excelente,5,68,"""¡Hermoso!""","""Fui en dia de muertos y en la escalinata ponen una super ofrenda enorme!, preciosa! Tienen que ir en Noviembre es espectacular! Tengo que decir que ahi ahora ya no es universidad, sino son oficinas del gobierno.""",México,Español,Móvil,1/7/2014
Femenino,31,Nacional,Excelente,5,57,"""Universidad""","""Es una excelente institución educativa, además cuenta con museos y exposiciones temporales que valen la pena visitar.""",México,Español,PC,1/7/2014
Masculino,27,Internacional,Muy bueno,4,119,"""Antigua universidad""","""Situado en el centro de Guanajuato, esta universidad es una de las más antiguas de México y sirvió de escenario para la grabaciones de películas ""Estudiante"", 2008. Sus largas escaleras ya son una atracción para aquellos que conocen el lugar y se puede entrar en el edificio incluso durante el período de clase.""",Portugal,Portugés,PC,21/6/2014
Masculino,20,Internacional,Excelente,5,8,"""Universidad de Guanajuato""","""¡Edificio con una hermosa arquitectura y caminar por los pasillos de la universidad que vale la pena hacerlo!""",Portugal,Portugés,PC,20/6/2014
Masculino,72,Internacional,Excelente,5,54,"""View from the stairs is an education in itself""","""I saw lots of advertisements for Language courses. That was something that was of interest to me. But I was only a vacationer with a few days here. This city is so fascinating. The former river beds which are now a maze of roadways intrigued me and also got me lost. But the view from the long steps of the university is spectacular.""",Estados Unidos,Inglés,PC,7/6/2014
Femenino,60,Nacional,Excelente,5,31,"""Extraordinaria arquitectura""","""Imponente, un lugar en donde la enseñanza y la cultura se entrelazan, su escalinata es preciosa digna de una postal.""",México,Español,PC,28/5/2014
Masculino,46,Internacional,Muy bueno,4,186,"""Nice!""","""The stairway led to a spectacular view of the city. it also was a nice walk. the university itself was old, well maintained. very nice.""",Estados Unidos,Inglés,PC,26/5/2014
Masculino,20,Nacional,Muy bueno,4,12,"""Excelente""","""Me encanto la arquitectura del edificio. También puedo mencionar que esta rodeado de fondas donde se puede comer económicamente y muy rico después de la visita o la caminada.""",México,Español,PC,24/5/2014
Femenino,35,Nacional,Muy bueno,4,14,"""Me encantó la arquitectura del lugar""","""Como todo en Guanajuato, la arquitectura que se maneja es preciosa, de tipo colonial, y su escalinata principal definitivamente es el centro de atención para muchas fotografías. Definitivamente, estoy enamorada de esta ciudad.""",México,Español,PC,14/5/2014
Masculino,25,Internacional,Excelente,5,15,"""Excellent atmosphere""","""I arrived with a college class, we ranged in age from 20-60 yrs of age. We toured the school briefly, but it was nice to see students walking about, studying. The campus also had a nighttime showing of a horror show, avail for a small fee. We sat on the university stairs and watched on, outdoors as classmates cheered. I spoke with some of the students, they were part of the art program and had lots of positive comments.""",Canadá,Inglés,PC,14/5/2014
Femenino,50,Internacional,Excelente,5,438,"""Hermosa vista de la ciudad""","""La Universidad es un lugar que debe ver, estando en Guanajuato. Tiene una hermosa escalera y la parte superior tiene una hermosa vista de la ciudad. Es posible ver el hermoso edificio de la Universidad cuando vamos en el funicular. Es un edificio histórico que debe ser visitado por los turistas por su belleza arquitectónica, que se imprime en la papeleta mil pesos.""",Brasil,Portugés,PC,14/5/2014
Masculino,42,Internacional,Muy bueno,4,49,"""Etapa de la película""","""Escaleras delanteras Antonio Banderasu, que era la escena en ""Desperado"" en la obra maestra protagonizada. Cifra que ha sido iluminado por la luz de la calle en la noche sobre el callejón para el recorrido es muy bonito.""",Japón,Japonés,PC,6/5/2014
Femenino,33,Nacional,Excelente,5,12,"""DAN GANAS DE ESTUDIAR""","""Es la máxima institución pública de estudios medios y superiores del Estado de Guanajuato. Su edificio demasiado hermoso y colonial. Definitivo si pudiese quedarme mas tiempo en la ciudad estudiaría ahí.""",México,Español,PC,28/4/2014
Masculino,24,Nacional,Excelente,5,37,"""Beautiful architecture""","""This university is famous because of its beautiful architecture, both outside and inside. It doesn't takes you too long to take a walk and take some photos. It worth.""",México,Español,PC,21/4/2014
Masculino,35,Nacional,Excelente,5,20,"""Muy bonita arquitectura""","""Un buen lugar para la foto y admirar la arquitectura del edificio principal de universidad así como subir las escalinatas para un buen relajamiento.""",México,Español,PC,16/4/2014
Masculino,69,Nacional,Excelente,5,8,"""Bello sitio""","""Es un edificio muy atractivo desde el punto de vista arquitectónico, que conjuga muy bien con el entorno. La escalinata principal es el lugar clásico para las fotos de recuerdo y desde su parte alta la vista es excelente.""",México,Español,PC,15/4/2014
Femenino,38,Nacional,Excelente,5,35,"""Es un Must!""","""No puedes decir que fuiste a Guanajuato sino visitas la Universidad y te tomas una foto es las escalinatas.

Normalmente hay dos lugares donde suele haber exposiciones de arte.
1) Al subir las escalinatas
2) Al pie de las escalinatas sobre la calle de Positos.

Si vas entre semana es más fácil que entres al interior y puedas apreciar la arquitectura. Los fines de semana está cerrado.""",México,Español,PC,12/4/2014
Femenino,26,Nacional,Excelente,5,1,"""Un lugar excelente para estudias""","""Las instalaciones de la escuela de diseño, son funcionales y los talleres de diseño son espaciosos y con mobiliario adecuado.""",México,Español,PC,10/4/2014
Masculino,43,Nacional,Muy bueno,4,394,"""Muy bonita""","""Esa escalinata cuesta trabajo subir y el que la sube es un placer si es que ahí estudies o solo de vista, en una gran ciudad de México.""",México,Español,PC,5/4/2014
Masculino,18,Nacional,Excelente,5,9,"""Definitivamente uno de los lugares mas hermosos de la ciudad""","""Nos encanto tomarnos fotos en la universidad de la ciudad, incluso compramos algunos recuerdos en la tienda de la universidad, es un icono del estado, todo muy bonito, por algo esta en los billetes de mil pesos.""",México,Español,PC,3/4/2014
Femenino,64,Internacional,Regular,3,109,"""Espléndido edificio no creo que sea Universidad""","""Por centro de la ciudad, que se encuentra en el lado norte de la plaza La Paz. Iglesia, teatro, es un museo que el edificio artística es mayor aprovechar esta ciudad, pero a diferencia de la imagen de la universidad japonesa sea el mismo, era como un castillo y mirar hacia el edificio de la escalera de la piedra. Fue visto durante el día, pero cuando la luz se enciende la noche parece más convertirse romántica.""",Japón,Japonés,PC,25/3/2014
Masculino,42,Internacional,Excelente,5,168,"""Great place to spend some time!""","""Don't just enjoy the architecture from near or far. Take the the time to explore inside. Like most of Guanajuato, enjoy the stairs!""",Canadá,Inglés,PC,15/3/2014
Masculino,25,Nacional,Muy bueno,4,24,"""Un pedazo de la historia de Guanajuato""","""Me gusto mucho la arquitectura, recorrer los pasillos, la biblioteca y descansar en las bancas, definitivamente tienen que visitar ese lugar al visitar Guanajuato.""",México,Español,PC,8/3/2014
Femenino,48,Nacional,Muy bueno,4,37,"""Hermosa""","""Es muy bonito caminar x el centro de la ciudad y encontrate con esta imponente fachada y sus escalinatas antojan tomar fotos para presumirlas, zona muy limpia y cuiada hacen sentirse bien, de las cosas mas importantes para visitar en esta bella ciudad.""",México,Español,PC,4/3/2014
Femenino,34,Nacional,Excelente,5,85,"""El edificio es impresionante""","""A partir de las fotos pensé que tenía más espacio, pero resultó encantador ver su disposición dentro de los callejones circundantes, la Falcultad de arquitectura enfrente del mercado Hidalgo es también interesante.""",México,Español,PC,28/2/2014
Femenino,20,Internacional,Excelente,5,64,"""Beautiful University!""","""We climbed to the top of the famous staircase at this university. It was a nice climb, and at the top are nice views of the city. You can see Al Pipila at the top of the mountain from here. Lots of people, students and locals alike, come to sit, chat, and snack here on the stairs. Very pretty architecture!""",Estados Unidos,Inglés,PC,27/2/2014
